{
  "schema_version": 2,
  "snapshot_id": "ontology.injection.default@2.0.0",
  "ontology_version": "2.0.0",
  "published_at": "2026-09-17T00:00:00Z",
  "rule_set": {
    "rule_set_code": "injection.default",
    "version": "2.0.0",
    "process": "injection",
    "scope_type": "system",
    "scope_key": "default"
  },
  "concepts": [
    {
      "concept_id": "process.injection",
      "concept_type": "process",
      "name_zh": "注塑成型",
      "name_en": "Injection molding",
      "definition": "使用注塑模具将熔融聚合物成型为塑料零件的制造过程。",
      "aliases": [
        "injection",
        "injection_molding"
      ],
      "properties": {},
      "status": "active"
    },
    {
      "concept_id": "G_WALL_THK_MIN",
      "concept_type": "geometric",
      "name_zh": "主体壁最小厚度",
      "name_en": "Minimum main-wall thickness",
      "definition": "由几何 Worker 按主体壁特征定义得到的最小客观厚度。",
      "aliases": [
        "thickness"
      ],
      "data_schema": {
        "type": "number",
        "exclusiveMinimum": 0
      },
      "properties": {
        "dimension": "length",
        "canonical_unit": "mm"
      },
      "status": "active"
    },
    {
      "concept_id": "G_WALL_IN_DRAFT",
      "concept_type": "geometric",
      "name_zh": "主体壁内侧拔模角",
      "name_en": "Main-wall inner draft angle",
      "definition": "由几何 Worker 按主体壁特征和已确认成型方向得到的内侧拔模角。",
      "aliases": [
        "draft"
      ],
      "data_schema": {
        "type": "number"
      },
      "properties": {
        "dimension": "angle",
        "canonical_unit": "degree"
      },
      "status": "active"
    },
    {
      "concept_id": "factor.model_units",
      "concept_type": "factor",
      "name_zh": "模型长度单位",
      "name_en": "Model length unit",
      "definition": "STEP模型创建时采用的长度单位。",
      "aliases": [
        "units",
        "model_unit"
      ],
      "data_schema": {
        "type": "string",
        "enum": [
          "mm"
        ]
      },
      "properties": {
        "runtime_key": "model_units",
        "default_value": "mm",
        "question": "What length unit was used to author the STEP model?",
        "source_policy": {
          "allowed_sources": [
            "USR",
            "CAD",
            "DEF"
          ],
          "auto_accept_sources": [
            "CAD",
            "DEF"
          ],
          "confirmation_required_sources": [],
          "min_confidence": null,
          "evidence_required": true,
          "conflict_policy": "ask_user",
          "missing_policy": "ask_user"
        }
      },
      "status": "active"
    },
    {
      "concept_id": "factor.material",
      "concept_type": "factor",
      "name_zh": "材料牌号",
      "name_en": "Material grade",
      "definition": "用于选择注塑工程规则的已确认材料牌号。",
      "aliases": [
        "resin"
      ],
      "data_schema": {
        "type": "string"
      },
      "properties": {
        "runtime_key": "material",
        "default_value": "ABS",
        "question": "What resin/material grade will be used for this part?",
        "source_policy": {
          "allowed_sources": [
            "USR",
            "DB",
            "DWG"
          ],
          "auto_accept_sources": [
            "DB"
          ],
          "confirmation_required_sources": [
            "DWG"
          ],
          "min_confidence": 0.75,
          "evidence_required": true,
          "conflict_policy": "ask_user",
          "missing_policy": "ask_user"
        }
      },
      "status": "active"
    },
    {
      "concept_id": "factor.pull_direction",
      "concept_type": "factor",
      "name_zh": "确认出模方向",
      "name_en": "Confirmed pull direction",
      "definition": "由用户确认并供方向相关识别和计算使用的三维向量。",
      "aliases": [
        "pull_dir",
        "mold_pull_direction"
      ],
      "data_schema": {
        "type": "array",
        "minItems": 3,
        "maxItems": 3,
        "items": {
          "type": "number"
        }
      },
      "properties": {
        "runtime_key": "pull_dir",
        "default_value": [
          0,
          0,
          1
        ],
        "question": "What is the confirmed mold pull direction as [x, y, z]?",
        "source_policy": {
          "allowed_sources": [
            "USR",
            "CAD",
            "DEF"
          ],
          "auto_accept_sources": [
            "CAD",
            "DEF"
          ],
          "confirmation_required_sources": [],
          "min_confidence": null,
          "evidence_required": true,
          "conflict_policy": "ask_user",
          "missing_policy": "ask_user"
        }
      },
      "status": "active"
    },
    {
      "concept_id": "check.main_wall_minimum_thickness",
      "concept_type": "check",
      "name_zh": "主体壁最小厚度",
      "name_en": "Main-wall minimum thickness",
      "definition": "判断普通主体区域的最小客观壁厚是否满足当前材料规则。",
      "aliases": [],
      "properties": {
        "default_severity": "warning",
        "report_group": "ordinary.wall_draft"
      },
      "status": "active"
    },
    {
      "concept_id": "feature.main_wall",
      "concept_type": "feature_type",
      "name_zh": "主体壁",
      "definition": "由现有 OCCT 主体壁识别器返回的实际壁面。",
      "properties": {
        "feature_kind": "main_wall"
      },
      "status": "active"
    },
    {
      "concept_id": "check.main_wall_minimum_draft",
      "concept_type": "check",
      "name_zh": "主体壁最小拔模角",
      "name_en": "Main-wall minimum draft",
      "definition": "判断普通主体区域的最小客观拔模角是否满足当前发布规则。",
      "aliases": [],
      "properties": {
        "default_severity": "warning",
        "report_group": "ordinary.wall_draft"
      },
      "status": "active"
    }
  ],
  "relations": [
    {
      "relation_id": "rel.process.injection.check.wall",
      "subject_id": "process.injection",
      "predicate": "HAS_CHECK",
      "object_id": "check.main_wall_minimum_thickness",
      "qualifiers": {},
      "sort_order": 10
    },
    {
      "relation_id": "rel.process.injection.check.draft",
      "subject_id": "process.injection",
      "predicate": "HAS_CHECK",
      "object_id": "check.main_wall_minimum_draft",
      "qualifiers": {},
      "sort_order": 20
    },
    {
      "relation_id": "rel.check.wall.operand.actual",
      "subject_id": "check.main_wall_minimum_thickness",
      "predicate": "USES_OPERAND",
      "object_id": "G_WALL_THK_MIN",
      "qualifiers": {
        "alias": "actual",
        "aggregation": "minimum",
        "required": true,
        "operand_text": "主体壁特征的最小客观厚度"
      },
      "sort_order": 20
    },
    {
      "relation_id": "rel.check.wall.factor.material",
      "subject_id": "check.main_wall_minimum_thickness",
      "predicate": "REQUIRES_FACTOR",
      "object_id": "factor.material",
      "qualifiers": {
        "usage_role": "rule_selector",
        "required": true,
        "missing_policy": "ask_user",
        "phase": "analysis",
        "question": "What resin/material grade will be used for this part?",
        "required_by": [
          "check.main_wall_minimum_thickness"
        ]
      },
      "sort_order": 30
    },
    {
      "relation_id": "rel.check.draft.feature.main_wall",
      "subject_id": "check.main_wall_minimum_draft",
      "predicate": "APPLIES_TO_FEATURE",
      "object_id": "feature.main_wall",
      "qualifiers": {},
      "sort_order": 10
    },
    {
      "relation_id": "rel.check.draft.operand.actual",
      "subject_id": "check.main_wall_minimum_draft",
      "predicate": "USES_OPERAND",
      "object_id": "G_WALL_IN_DRAFT",
      "qualifiers": {
        "alias": "actual",
        "aggregation": "minimum",
        "required": true,
        "operand_text": "主体壁特征相对确认成型方向的最小内侧拔模角"
      },
      "sort_order": 20
    },
    {
      "relation_id": "rel.check.draft.factor.pull",
      "subject_id": "check.main_wall_minimum_draft",
      "predicate": "REQUIRES_FACTOR",
      "object_id": "factor.pull_direction",
      "qualifiers": {
        "usage_role": "calculation_input",
        "required": true,
        "missing_policy": "ask_user",
        "phase": "analysis",
        "question": "What is the confirmed mold pull direction as [x, y, z]?",
        "required_by": [
          "geometry.draft"
        ]
      },
      "sort_order": 30
    },
    {
      "relation_id": "rel.process.injection.factor.units",
      "subject_id": "process.injection",
      "predicate": "REQUIRES_FACTOR",
      "object_id": "factor.model_units",
      "qualifiers": {
        "usage_role": "calculation_input",
        "required": true,
        "missing_policy": "ask_user",
        "phase": "discovery",
        "question": "What length unit was used to author the STEP model?",
        "required_by": [
          "geometry.load",
          "feature.dimension_classification"
        ]
      },
      "sort_order": 10
    },
    {
      "relation_id": "rel.check.wall.feature.main_wall",
      "subject_id": "check.main_wall_minimum_thickness",
      "predicate": "APPLIES_TO_FEATURE",
      "object_id": "feature.main_wall",
      "qualifiers": {},
      "sort_order": 11
    }
  ],
  "factor_options": [
    {
      "factor_id": "factor.model_units",
      "option_code": "MM",
      "name_zh": "毫米",
      "value": "mm",
      "sort_order": 10,
      "status": "active"
    },
    {
      "factor_id": "factor.material",
      "option_code": "ABS",
      "name_zh": "ABS",
      "value": "ABS",
      "sort_order": 10,
      "status": "active"
    }
  ],
  "rules": [
    {
      "rule_version_id": "rule-version.main-wall-min-abs.1",
      "rule_id": "R_INJ_MAIN_WALL_MIN_ABS",
      "version": "1.0.0",
      "check_id": "check.main_wall_minimum_thickness",
      "name": "ABS主体壁最小厚度",
      "conditions": [
        {
          "factor_id": "factor.material",
          "operator": "EQ",
          "value": "ABS"
        }
      ],
      "expression": {
        "operand": "actual"
      },
      "comparator": "GTE",
      "threshold": 1.2,
      "result_unit": "mm",
      "severity": "warning",